{
  "ipaddress": "example_value",
  "netmask": "example_value",
  "nsvlan": 10,
  "ifnum": "example_value",
  "tagged": "example_value",
  "httpport": [],
  "maxconn": 10,
  "maxreq": 10,
  "cip": "example_value",
  "cipheader": "example_value",
  "cookieversion": "example_value",
  "securecookie": "example_value",
  "pmtumin": 10,
  "pmtutimeout": 10,
  "ftpportrange": "example_value",
  "timezone": "example_value",
  "grantquotamaxclient": 10,
  "grantquotaspillover": 10,
  "crportrange": "example_value",
  "systemtype": "example_value",
  "primaryip": "example_value",
  "primaryip6": "example_value",
  "flags": 10,
  "lastconfigchangedtime": "example_value",
  "lastconfigsavetime": "example_value",
  "currentsytemtime": "example_value",
  "systemtime": 10,
  "configchanged": true,
  "mappedip": "example_value",
  "range": 10
}